{
  "schemaVersion": 6,
  "suitePath": "suites/refactoring-miner-git-regressions.json",
  "repoPath": "RefactoringMiner",
  "outDir": "refactoringminer-real-matrix",
  "provenance": {
    "helmbenchVersion": "0.1.0",
    "suiteHash": "suite:3cb60b9dde3555a6",
    "repoHead": "949bddcd3509a805f5e3bcc55fcdb71a691b0dac",
    "repoDirty": false,
    "setupCommandCount": 0,
    "setupCommandHashes": []
  },
  "suiteEvidenceUse": "outcome_ready",
  "baseline": {
    "name": "native",
    "agent": "claude-code",
    "variant": "native",
    "reportPath": "reports/native.json",
    "traceDir": "traces/native",
    "autopsyMarkdown": "docs/native-autopsy.md",
    "comparisonJson": null,
    "comparisonMarkdown": null,
    "ctxhelmEnabled": false,
    "packEnabled": false,
    "streamCaptureEnabled": false,
    "adapterPreset": "claude-code",
    "adapterCommandHash": "cmd:30a03a4d251df406",
    "ctxhelmConfigHash": null
  },
  "heads": [
    {
      "name": "ctxhelm",
      "agent": "claude-code",
      "variant": "ctxhelm_mcp",
      "reportPath": "reports/ctxhelm.json",
      "traceDir": "traces/ctxhelm",
      "autopsyMarkdown": "docs/ctxhelm-autopsy.md",
      "comparisonJson": "reports/compare-ctxhelm.json",
      "comparisonMarkdown": "docs/compare-ctxhelm.md",
      "ctxhelmEnabled": true,
      "packEnabled": true,
      "streamCaptureEnabled": false,
      "adapterPreset": "claude-code",
      "adapterCommandHash": "cmd:30a03a4d251df406",
      "ctxhelmConfigHash": "ctxhelm:9832d53201405f28"
    }
  ],
  "artifacts": {
    "suiteHealthJson": "reports/suite-health.json",
    "benchmarkSummaryJson": "reports/benchmark-summary.json",
    "benchmarkSummaryMarkdown": "docs/benchmark-summary.md",
    "qualityGateJson": "reports/quality-gate.json",
    "qualityGateMarkdown": "docs/quality-gate.md",
    "privacyReportJson": "reports/privacy-report.json",
    "privacyReportMarkdown": "docs/privacy-report.md",
    "dashboardHtml": "docs/dashboard.html",
    "baselineAutopsyMarkdown": "docs/native-autopsy.md",
    "reproductionMarkdown": "docs/reproduction.md",
    "evidenceManifest": "evidence/manifest.json"
  },
  "artifactDigests": [
    {
      "path": "docs/benchmark-summary.md",
      "byteCount": 2268,
      "contentHash": "fnv64:a0b83b80acd0fd4f"
    },
    {
      "path": "docs/compare-ctxhelm.md",
      "byteCount": 472,
      "contentHash": "fnv64:7ea9c31da4a4dfef"
    },
    {
      "path": "docs/ctxhelm-autopsy.md",
      "byteCount": 6783,
      "contentHash": "fnv64:e2a95f53df10fa1c"
    },
    {
      "path": "docs/dashboard.html",
      "byteCount": 11529,
      "contentHash": "fnv64:d053936392b24f45"
    },
    {
      "path": "docs/native-autopsy.md",
      "byteCount": 6232,
      "contentHash": "fnv64:a80748ab7b01e9fa"
    },
    {
      "path": "docs/privacy-report.md",
      "byteCount": 1776,
      "contentHash": "fnv64:285d56842ace1873"
    },
    {
      "path": "docs/quality-gate.md",
      "byteCount": 970,
      "contentHash": "fnv64:996495c475807a79"
    },
    {
      "path": "docs/reproduction.md",
      "byteCount": 2464,
      "contentHash": "fnv64:ff52091afc1f953c"
    },
    {
      "path": "evidence/manifest.json",
      "byteCount": 1705,
      "contentHash": "fnv64:d12bb8f1e1731efd"
    },
    {
      "path": "reports/benchmark-summary.json",
      "byteCount": 5551,
      "contentHash": "fnv64:51e535e4de5e1da3"
    },
    {
      "path": "reports/compare-ctxhelm.json",
      "byteCount": 656,
      "contentHash": "fnv64:6253aceb6fc625be"
    },
    {
      "path": "reports/ctxhelm.json",
      "byteCount": 12236,
      "contentHash": "fnv64:6396466441b4f178"
    },
    {
      "path": "reports/native.json",
      "byteCount": 12167,
      "contentHash": "fnv64:ddb637ce972f26bf"
    },
    {
      "path": "reports/privacy-report.json",
      "byteCount": 2260,
      "contentHash": "fnv64:d0924f95413b2986"
    },
    {
      "path": "reports/quality-gate.json",
      "byteCount": 2365,
      "contentHash": "fnv64:367916cac7bf87fb"
    },
    {
      "path": "reports/suite-health.json",
      "byteCount": 5395,
      "contentHash": "fnv64:122a20961c1df6ef"
    },
    {
      "path": "traces/ctxhelm/git-regression-092c13f035f9.json",
      "byteCount": 4756,
      "contentHash": "fnv64:7bfbe60f3ffee227"
    },
    {
      "path": "traces/ctxhelm/git-regression-1b04d6aae2e4.json",
      "byteCount": 4579,
      "contentHash": "fnv64:1eee1cfd975f10fe"
    },
    {
      "path": "traces/ctxhelm/git-regression-1b9f2cf08b3c.json",
      "byteCount": 4590,
      "contentHash": "fnv64:cc87b66ae64c9f09"
    },
    {
      "path": "traces/ctxhelm/git-regression-23e298ae221c.json",
      "byteCount": 4669,
      "contentHash": "fnv64:0fe0d4f29a3c108a"
    },
    {
      "path": "traces/ctxhelm/git-regression-4fa3c1a48ad4.json",
      "byteCount": 4506,
      "contentHash": "fnv64:49eb40801cd755bd"
    },
    {
      "path": "traces/ctxhelm/git-regression-949bddcd3509.json",
      "byteCount": 4687,
      "contentHash": "fnv64:db22fcd16c8dc7e4"
    },
    {
      "path": "traces/ctxhelm/git-regression-97e31265fd95.json",
      "byteCount": 4659,
      "contentHash": "fnv64:2c176b6e3b3da223"
    },
    {
      "path": "traces/ctxhelm/git-regression-bd0b2277933f.json",
      "byteCount": 4656,
      "contentHash": "fnv64:e7ed1c33ceebd750"
    },
    {
      "path": "traces/ctxhelm/git-regression-fa29ed0c80c8.json",
      "byteCount": 4667,
      "contentHash": "fnv64:982afa49fb60fb1e"
    },
    {
      "path": "traces/ctxhelm/git-regression-fa8df046b0e0.json",
      "byteCount": 4646,
      "contentHash": "fnv64:b4806326dcdd9270"
    },
    {
      "path": "traces/native/git-regression-092c13f035f9.json",
      "byteCount": 1184,
      "contentHash": "fnv64:b3684128260a8df4"
    },
    {
      "path": "traces/native/git-regression-1b04d6aae2e4.json",
      "byteCount": 1518,
      "contentHash": "fnv64:8a0f3e1fb1a75122"
    },
    {
      "path": "traces/native/git-regression-1b9f2cf08b3c.json",
      "byteCount": 2426,
      "contentHash": "fnv64:1e03e913334e3677"
    },
    {
      "path": "traces/native/git-regression-23e298ae221c.json",
      "byteCount": 2093,
      "contentHash": "fnv64:1cbd0652049123f4"
    },
    {
      "path": "traces/native/git-regression-4fa3c1a48ad4.json",
      "byteCount": 1908,
      "contentHash": "fnv64:98f0ab9a9baaac1a"
    },
    {
      "path": "traces/native/git-regression-949bddcd3509.json",
      "byteCount": 1561,
      "contentHash": "fnv64:a0b7b64f4a916cfb"
    },
    {
      "path": "traces/native/git-regression-97e31265fd95.json",
      "byteCount": 759,
      "contentHash": "fnv64:cad5de7b62285550"
    },
    {
      "path": "traces/native/git-regression-bd0b2277933f.json",
      "byteCount": 1962,
      "contentHash": "fnv64:b42d8bf89efa1248"
    },
    {
      "path": "traces/native/git-regression-fa29ed0c80c8.json",
      "byteCount": 780,
      "contentHash": "fnv64:83aab464274c9e53"
    },
    {
      "path": "traces/native/git-regression-fa8df046b0e0.json",
      "byteCount": 1470,
      "contentHash": "fnv64:8954a819275d72d7"
    }
  ],
  "qualityGatePassed": false,
  "evidenceBundleVerified": true,
  "privacy": {
    "sourceFree": true,
    "rawSourceLogged": false,
    "rawPromptLogged": false,
    "rawTranscriptLogged": false,
    "rawTerminalLogged": false
  }
}